{
  "schemaVersion": 1,
  "sealedAt": "2026-08-04",
  "policy": "ここに定義した期間のデータは、Production Gate 判定のとき以外は一切参照しない。研究中（idea〜shadow）の Edge が参照した場合、CI が holdout_leak として失敗させる。開封は research:holdout:open のみで行い、access_log.jsonl に記録が残る。",
  "windows": [
    {
      "id": "vault-2025h2-2026h1",
      "from": "2025-07-01",
      "to": "2026-06-30",
      "scope": "all_universe",
      "notes": "直近1年を最終検証用に封印する。研究は 2025-06-30 以前のデータで行う。"
    },
    {
      "id": "vault-2026h2-2027h1",
      "from": "2026-07-01",
      "to": "2027-06-30",
      "scope": "all_universe",
      "notes": "2026-09-17 に追加して封印した。この期間の価格は毎朝取り込んでいるが、研究では読んでいない（研究の CLI は 2025-06-30 より後を拒否する）。見たのは TDnet の見出しと件数、取り込み済みの日付の一覧だけ。TDnet のラベルはこの期間にしか無いので、不祥事の測定と急落売りの確認は、事前登録したうえで research:holdout:open から1回ずつだけ開ける。"
    }
  ]
}
